{
  "transcript_id": "demo-transcript-1",
  "kind": "fulfillment",
  "prev_hash": "1111111111111111111111111111111111111111111111111111111111111111",
  "terms_hash": "2222222222222222222222222222222222222222222222222222222222222222",
  "hlc_physical_ms": 1100,
  "hlc_logical": 2,
  "actor_did": "did:exo:demo-service",
  "grantor_did": "did:exo:demo-principal",
  "parties": [
    { "did": "did:exo:demo-principal", "role": "bailor" },
    { "did": "did:exo:demo-agent", "role": "bailee", "agent_for": "did:exo:demo-principal" },
    { "did": "did:exo:demo-service", "role": "service" },
    { "did": "did:exo:demo-witness", "role": "witness" }
  ],
  "threshold": 3,
  "permission_ceiling": ["Read"],
  "requested_permissions": ["Read"],
  "amount_minor": 100,
  "currency": "USD",
  "signature_hex": "abababababababababababababababababababababababababababababababababababababababababababababababababababababababababababababababab",
  "payload": {
    "fulfillment_hash": "3333333333333333333333333333333333333333333333333333333333333333",
    "pdp_evidence_hash": "2222222222222222222222222222222222222222222222222222222222222222"
  }
}
